{
  "sessionId": "session_1779877247432",
  "createdAt": "2026-05-27T10:20:47.463Z",
  "updatedAt": "2026-05-27T10:40:25.195Z",
  "lastAccessedAt": "2026-05-27T10:40:25.185Z",
  "memoryVersion": "1.0.0",
  "lifecycleState": "ACTIVE",
  "checksums": {
    "history": "f4cc41d08a3469a273afc716019976746ec11ffe56d637b533493c4a90a8bf9c",
    "sessionMemory": "5be246b036a95013637d52bab921c3479c47de31e87ee34496b34110a86eaee4"
  },
  "confidence": {},
  "tags": [],
  "quotas": {
    "maxSessions": 100,
    "maxHistorySize": 10485760,
    "maxWorkingMemorySize": 1500,
    "maxSessionMemorySize": 1000,
    "maxSnapshots": 10
  }
}